{"$schemaId":"https://schemas.cp6.dev/release/system-lineage-bootstrap-evidence.v1","authority":{"commitSha":"bbbbbbbbbbbbbbbbbbbbbbbbbbbbbbbbbbbbbbbb","environment":"test","repository":"GTX537/CP6.Platform","runAttempt":1,"runId":123,"workflowFileSha":"bbbbbbbbbbbbbbbbbbbbbbbbbbbbbbbbbbbbbbbb","workflowPath":".github/workflows/p10-test.yml"},"createdAtUtc":"2026-09-01T00:00:00.000Z","reason":"Initial System lineage authority.","signaturePolicy":"BootstrapOnly","systemManifestSubject":{"sha256OrDigest":"ea8f8b4677428d3e3fb59603a399a404c231ea7bacc7eafd26b2a1c1c3ceea18","sourceGitSha":"bbbbbbbbbbbbbbbbbbbbbbbbbbbbbbbbbbbbbbbb","subjectKind":"SystemManifest","subjectName":"system-release-manifest.v1"},"trustPolicyVersion":3}